,name,title,description,creator,youtube_url,template_url,date_posted
78,AI Avatar Social Automation,This n8n AI Agent Avatar will AUTOMATE your Social Media,"This video details a fully automated social media workflow that leverages a custom AI agent to fetch Hacker News articles, generate a video script via ChatGPT, and then create an AI avatar video using HeyGen with optional 11 Labs voice integration and a faceless background video via Blotato. The system, built exclusively in n8n, automates content creation and multi-platform publishing (Instagram, YouTube, Facebook, Threads, LinkedIn, Twitter, TikTok). Created by Sabrina Ramonov, it includes a free template available through her provided link.",Sabrina Ramonov 🍄,https://www.youtube.com/watch?v=8sPYxqU1SoQ,https://drive.google.com/file/d/1b8ItsS54kg-SS1vJNUbeImKM-qFRzhhd/view?usp=drive_link,2025-04-12T17:28:07.000Z
79,LinkedIn AI Agent,I Built an AI Agent For VIRAL LinkedIn Posts (n8n),"This video details an advanced automation system for LinkedIn content creation. It scrapes competitor profiles, extracts multimedia data (text, images, PDFs, and videos), and repurposes viral posts using AI-driven rewriting processes with OpenAI and Perplexity integrations. The workflow also includes a Telegram-based agent that transcribes voice messages into text and uses AI to generate post content. Built by Oleg Melnikov, the system integrates database management with AirTable and offers a free template for immediate setup.",Oleg Melnikov,https://www.youtube.com/watch?v=GmlQZ8MG7HY,https://drive.google.com/file/d/16Pw1GwO7NnhO_Rcs4oXVcBvcC4S-3sYG/view?usp=drive_link,2025-04-12T14:41:09.000Z
80,Automated Sales Agents,How to build an army of Ai Sales Agents (automate 70% of your sales processes),"This workflow automates up to 70% of your sales process by using AI agents to parse incoming Gmail messages, extract lead data via LLM-driven steps, and integrate with Tavi for website and LinkedIn scrapes. It updates and manages lead data in Airtable while leveraging Google Docs as a dynamic knowledge base for drafting personalized email responses with a human-in-loop approval. Created by Rory Ridgers, this system streamlines sales automation in a robust, scalable pipeline.",Rory Ridgers,https://www.youtube.com/watch?v=1MzQkN6C5D0,https://drive.google.com/file/d/1ESCFq9730iouuEIyoqXX-vGrstlhpe23/view?usp=drive_link  https://drive.google.com/file/d/1kcKN0RkPGPcA40HgLABg1myNng9rMTkL/view?usp=drive_link ,2025-04-12T12:00:05.000Z
81,Claude MCP Agent,Build A Claude MCP Agent That Does Everything!,"This video demonstrates a comprehensive Claude MCP agent system that integrates multiple workflows such as email, calendar, CRM, Slack, WhatsApp, and LinkedIn using an n8n-based MCP server. Ben from Ben AI explains how to set up the agent with robust API configurations, SSE endpoints and tool-specific commands to automate daily business tasks. The free template provided allows you to replicate the system for your own deployments.",Ben AI,https://www.youtube.com/watch?v=bATMtzNoap4,https://drive.google.com/file/d/1u-9TkM8UVl7Pu6kgw9caeL9228pGYOhZ/view?usp=drive_link  https://drive.google.com/file/d/1L7hxkZbSOZA9vOULhnkWF-fPs6zfYmp6/view?usp=drive_link ,2025-04-12T08:22:06.000Z
82,9-Platform Social Poster,n8n Agent Posts to 9 Social Platforms Hourly!,"This system is an automated workflow that reads content details from a Google Sheet, extracts media from Google Drive, and uses API calls to a dedicated social media integration service to post across 9 platforms including Instagram, YouTube, Facebook, Threads, LinkedIn, Twitter, TikTok, Blue Sky and Pinterest. It employs schedule triggers, filters, and dynamic JSON requests for each platform. Created by Sabrina Ramonov 🍄, the free template enables plug-and-play automation for social media publishing.",Sabrina Ramonov 🍄,https://www.youtube.com/watch?v=D9okDd_1tBI,https://drive.google.com/file/d/1UogWtgWOqfpD21SqneurX7KCp2y2fQTq/view?usp=drive_link,2025-04-11T23:55:43.000Z
84,Crawl4AI Scraper,Scrape ANY Website for FREE with Crawl4AI + n8n (No Code),"This workflow integrates a locally hosted, Docker-deployed Crawl4AI instance with an automation system to scrape websites for free using multiple strategies – basic extraction, LLM-driven structuring, and CSS selectors for paginated product data. It uses URL extraction, HTTP polling for task status, and proxy integration with Enro CLI for secure external access. Demonstrated by Mahmut Kasimoglu, the free template is available through his Skool community.",Mahmut Kasimoglu | AI Automation,https://www.youtube.com/watch?v=1CDGpbZItiY,https://drive.google.com/file/d/1qVgaZbTZdlcL3Ceg4PBoTZ-ONMzujWa8/view?usp=drive_link,2025-04-09T12:28:33.000Z
85,Omnichannel Sales Agent,This AI Agent Automates Your Sales on ALL Social Media (+MCP),"This system automates social media sales across WhatsApp, Facebook Messenger and Instagram DMs using a no-code workflow. It features a multi-agent AI setup with sub-agents handling CRM (via AirTable) and calendar scheduling. The workflow leverages RAG with Superbase, uses the WhatsApp Business API with outbound template messaging through webhooks, and demonstrates MCP integration for dynamic API tool selection. Created by Ben AI, a free template is provided for immediate implementation.",Ben AI,https://www.youtube.com/watch?v=VnbfsX7iBl4,https://drive.google.com/file/d/15MLlSCnjMWm9Vdlw_WjTynJlPQWAladL/view?usp=drive_link  https://drive.google.com/file/d/1P9jtemW1psUoWGSc6UuAnrn06X-Wa81M/view?usp=drive_link  https://drive.google.com/file/d/1j4IfpgXVACXtqIpu_GwZHSFBTmv8Dfl1/view?usp=drive_link  https://drive.google.com/file/d/1c5dzocUh9IC5bQwqKwJCo6ZZ2mjYRtqZ/view?usp=drive_link ,2025-04-09T06:42:57.000Z
86,Sheets Dashboard Automation,How I Create Custom n8n Dashboards To Automate Anything (Google Sheets),"This system demonstrates a custom automation workflow using Google Sheets as a dynamic dashboard. It leverages form submission triggers, conditional logic, webhooks, and Google Apps Script to update and manage data—automating tasks such as sending emails, calendar invites, and invoices. The workflow integrates with external systems like GoHighLevel and uses switch cases to route actions based on data changes. Created by Jono Catliff, all blueprints are offered as free templates.",Jono Catliff,https://www.youtube.com/watch?v=Mw9AIejD39s,https://drive.google.com/file/d/107ZLDb3F765CYbQyhL-2fnFzy6A0Bo2k/view?usp=drive_link  https://drive.google.com/file/d/1wfnGidoUbiXdIbp1zCMsROrIFO4eO2lH/view?usp=drive_link ,2025-04-09T01:00:03.000Z
87,LinkedIn Content Creator,3 AI Workflows Step-by-Step (Beginner's Guide to n8n),"In this video, Nate Herk demonstrates a complete automated system for generating LinkedIn posts using n8n. The workflow pulls topics from a Google Sheet, performs a web search via the Tavali API, and leverages an AI agent (via Open Router) to craft engaging post content. It integrates additional services such as Gmail for follow-ups, OpenAI embeddings, and Pinecone for vector storage. Free setup instructions and resources are available via a Skool community template.",Nate Herk | AI Automation,https://www.youtube.com/watch?v=06Beyp_iDL0,https://drive.google.com/file/d/1yf2ncloV_YSoO6W5KkZR5jo247V8aeBO/view?usp=drive_link  https://drive.google.com/file/d/1pbHvDIEz6WXkZ4dqOeSN4JlP_ZCAB3H5/view?usp=drive_link  https://drive.google.com/file/d/18Cc9YhwEYPGmd26EkveKp1gkLJSdHLf6/view?usp=drive_link,2025-04-07T13:42:58.000Z
88,Sales Lead Automation,How I Increased Sales By 391% With One Change (Steal It),"This system automates lead follow-up using a no-code workflow on n8n. It captures form submissions via a webhook trigger and integrates with a CRM (GoHighLevel) to initiate fast outbound calls, logs lead data into Google Sheets, and sends real-time Telegram notifications. The demo includes step-by-step API data mapping and multi-module orchestration to maximize conversion rates. Created by Jono Catliff, the free blueprint template is available for immediate import.",Jono Catliff,https://www.youtube.com/watch?v=PWLVWhMh7og,https://drive.google.com/file/d/1SvKBdfK6klqkqDYlrAA4N7UNV1zWHzBg/view?usp=drive_link,2025-04-06T14:04:40.000Z
89,Viral TikTok System,I Built an AI SYSTEM for Viral TikToks (n8n Tutorial),"This system is an n8n workflow built to automate the analysis of top-performing TikTok videos from selected influencers. It uses a schedule trigger, loops over influencer data stored in AirTable, and scrapes recent TikToks via HTTP requests. The workflow sorts videos by views, filters for video posts, and then leverages Gemini (Google's AI service) for video analysis to extract key viral factors. Advanced nodes include code formatting, delay/wait logic, JSON parsing, and API integrations. Created by Oleg Melnikov, the template is available for free.",Oleg Melnikov,https://www.youtube.com/watch?v=OSpw9AY1fJI,https://drive.google.com/file/d/13k2MOqI2BCgWTWPwOWNSAddGxlvRarlK/view?usp=drive_link,2025-04-05T18:44:01.000Z
91,CRM Data Automation,AI AUTOMATES Your CRM Updates!,"MagicOps AI presents a dedicated workflow that automates CRM updates tailored for real estate and similar data-intensive businesses. The system triggers on ClickUp status changes to create corresponding Google Drive folders, processes Gmail attachments with PDF extraction using GPT-4 mini, and updates CRM fields. It integrates key APIs from ClickUp, Gmail, and Google Drive while using custom code nodes for splitting attachments. A free, ready-to-use template is available from MagicOps AI.",MagicOps AI,https://www.youtube.com/watch?v=_oNrsL0GJBw,https://drive.google.com/file/d/1LVW2SP7kXj_hgJYa8fg5XdGOr-osibcd/view?usp=drive_link  https://drive.google.com/file/d/1tKbZgm_YFmXSX3IGYtuAvg38FE9yJl3t/view?usp=drive_link ,2025-04-04T13:17:24.000Z
92,Long Form Video System,How I 100% Automated Long Form Content with n8n (free template),"This system automates the creation of faceless, long-form YouTube videos using an n8n workflow. It integrates workflow nodes that pull data from a Google Sheet, generate intro/outro scripts and a top 10 ranking via AI agents, and compile visuals using the JSON2Video API alongside ElevenLabs for realistic voiceovers. The workflow uses polling for video status and uploads the finished video to YouTube. Free template available via a Skool community by Nate Herk.",Nate Herk | AI Automation,https://www.youtube.com/watch?v=lF2bvXoV-Zg,https://drive.google.com/file/d/1RsonZRI1buGbXwzJcly7VWt427gP339W/view?usp=drive_link,2025-04-03T16:13:28.000Z
94,LinkedIn DM System,Build This Automated AI LinkedIn DM System in 1 Hour (N8N),"This system automates LinkedIn outreach by scraping Apollo leads with an Apify actor, enriching them using AI-powered personalization, and generating custom icebreakers via OpenAI. The workflow logs data in Google Sheets, triggers webhooks, and sends targeted connection requests using PhantomBuster. Developed by Nick Saraev, the solution streamlines manual outreach into a coherent automated process, and the provided template is completely free.",Nick Saraev,https://www.youtube.com/watch?v=gsPGdq2C97c,https://drive.google.com/file/d/1587u1Up2vB5nQ8AeHMvXmqzOZ3lHbynB/view?usp=drive_link,2025-04-02T02:16:06.000Z
95,Gemini Media Analyzer,"Analyze any Video, Image or PDF with Gemini and n8n (Step-by-Step)","In this step-by-step tutorial by MagicOps AI, a specific automation system is built for analyzing videos, images, and PDFs via the Gemini API. The system utilizes HTTP Request nodes, resumable upload techniques, dynamic JSON handling, and API integration to extract structured data (such as video format and topic). The walkthrough covers API authentication, file uploads, and configuring request headers, culminating in a free template for immediate use.",MagicOps AI,https://www.youtube.com/watch?v=OWJKGkPEGSw,https://drive.google.com/file/d/1IpgIE8XTSjCBDWqlwdp93HPGU7Iq_6YE/view?usp=drive_link,2025-04-01T13:17:33.000Z
96,Prompt Engineer Agent,How to Build Your PERSONAL Prompt Engineer Agent with n8n (for any model!),"This system automates prompt engineering via an n8n workflow that dynamically selects and refines prompt generation for various LLMs such as OpenAI, Anthropic, and Gemini. It employs dedicated sub-workflows, context buffering, markdown formatting, and quality proofing nodes to differentiate between reasoning and non‐reasoning models. Triggered via chat input with Whisper Flow transcription, it streamlines prompt optimization. Creator Mark Kashef details technical integration and scalability in this advanced setup.",Mark Kashef,https://www.youtube.com/watch?v=c-NdrhFbUxY,https://drive.google.com/file/d/1NyFafJnrtUi7TOVLscPU_b8RS56M2U2X/view?usp=drive_link  https://drive.google.com/file/d/1VOR6we1twlcOK6KqdBVKymZ1rdPieMjW/view?usp=drive_link  https://drive.google.com/file/d/12Lyb9rlIbrWBk69QE7VGIDtNsRoAu4YJ/view?usp=drive_link  https://drive.google.com/file/d/13oEa3bVH2l3Q0FX6dMGwXOWCB_PiufVk/view?usp=drive_link  https://drive.google.com/file/d/1Xv2Rc0Mr2KsX1PqydpGPcvSLVY2cgxxG/view?usp=drive_link ,2025-03-31T19:57:49.000Z
97,AI PDF Research Report,Research ANYTHING and Get a PDF Report (free n8n template),"This system is an advanced AI research workflow that generates detailed PDF reports from a single search topic. It automates the process by using AI agents to break down a subject into chapters, retrieve and format multiple research sources via Tavi, merge data from Google Sheets, and compile a structured HTML output that is converted into a clickable PDF using an HTML-to-PDF API. Built by Nate Herk, this free template is available in his Skool community for cost-effective, high-quality report generation.",Nate Herk | AI Automation,https://www.youtube.com/watch?v=TeFCb5-4e5U,https://drive.google.com/file/d/1ywEBz6UjLDv68uB2t4colnqmOrykwjMe/view?usp=drive_link,2025-03-30T21:07:44.000Z
99,Support Email AI Workflow,We're All Using AI Agents Wrong.,"In this video, Nate Herk explains a detailed, deterministic AI workflow system built in n8n that automates customer support email responses. The system uses Google Drive for document ingestion, Pine Cone for vector-based searches, and an OpenAI node for generating accurate replies, all integrated in a linear flow for improved reliability, cost-efficiency, and easier debugging. A free template is available via the creator’s community.",Nate Herk | AI Automation,https://www.youtube.com/watch?v=HuTyZiUDz2k,https://drive.google.com/file/d/1J2xOp3hobZ2AjlkMaRzTdgSqb_U73dVe/view?usp=drive_link  https://drive.google.com/file/d/1ZxZJWKeLwDtrINECXwrECI8-9H94aNzZ/view?usp=drive_link ,2025-03-27T20:15:32.000Z
100,Multi-Agent Supervisor System,Don't Build Another AI Agent Until You See This: Langchain’s Multi Agent Architecture ~ n8n,"In this video by Mahmut Kasimoglu, a multi-agent workflow system is demonstrated that uses a supervisor agent to orchestrate specialized sub-agents for handling emails, contacts, calendars, and context queries. The system, inspired by Langchain’s multi-agent architecture, shows how tasks are delegated sequentially or in parallel for improved efficiency and debugging. It is implemented in n8n with a free JSON workflow template available to download via his Skool community.",Mahmut Kasimoglu | AI Automation,https://www.youtube.com/watch?v=Ah-1-Lda4DU,https://drive.google.com/file/d/1Z_RSpNhoAA06YMtuzUb-jcDEkC8xU6_9/view?usp=drive_link,2025-03-26T18:52:50.000Z
101,TikTok Viral Scraper,Want Viral TikTok Videos? Copy This AI System Now | N8N Tutorial,"This system automates TikTok content analysis by scraping trending videos via Apify and managing topic data in Airtable. It downloads videos, stores them temporarily on Google Drive, and then leverages Google’s Gemini AI to extract key metrics such as hooks, visual cues, view counts, and captions. The workflow uses scheduled triggers and iterative processing to update Airtable records. Developed by MagicOps AI, the free template streamlines viral content strategy.",MagicOps AI,https://www.youtube.com/watch?v=IWUy79cSp60,https://drive.google.com/file/d/1SlrxzebxsPoE5hWiZj2gjnalItYBrf6v/view?usp=drive_link,2025-03-26T13:57:12.000Z
103,Jarvis Assistant,"How I Built JARVIS with No Code (Tutorial w/ Lovable, ElevenLabs, n8n)","This video demonstrates a complete no-code AI assistant system that integrates a voice UI built with Lovable and ElevenLabs with a backend automated workflow built on n8n. The system uses multiple sub-agents including email, calendar, contacts, and content creation along with a Tavly search tool. Creator Nate Herk explains how to configure API integrations, webhooks, and tool chaining, and offers the free template via his Skool community resource for replicating the workflow.",Nate Herk | AI Automation,https://www.youtube.com/watch?v=KUvSzvFeZls,https://drive.google.com/file/d/1kDObptC2SpkViCPxI7ajFP7phBm-7M6t/view?usp=drive_link  https://drive.google.com/file/d/11kmVhQxb9nFV0PJr-C_RyFg1ZNjaIEL4/view?usp=drive_link  https://drive.google.com/file/d/1GJLNj5MiPjG_u1eXEIKtUWtfLAKvD9ov/view?usp=drive_link  https://drive.google.com/file/d/1BfHwX2aKv9FXbbGoEuZxD_WTBDvK6x8G/view?usp=drive_link  https://drive.google.com/file/d/1TqY55BSuEycBfXC9QjL9aEFHwng3IU2T/view?usp=drive_link ,2025-03-23T19:37:30.000Z
106,Resume Screener,This AI Resume Screener Will Change How You Hire Forever!,"Mahmut Kasimoglu demonstrates a robust AI resume screening workflow that automates candidate evaluation using a no-code automation tool. The system integrates Gmail triggers for email-based resume intake, AirTable for data management, and employs multiple AI models (GPT-4o, Claude 3.5, Gemini 2.0 flash, and o3 mini) within evaluator/optimizer and voting parallelization patterns. The workflow processes PDF/HTML resumes, extracts structured data, and iteratively aggregates scores. A free template is available via the linked community resource.",Mahmut Kasimoglu | AI Automation,https://www.youtube.com/watch?v=lGnsQ3qWUmk,https://drive.google.com/file/d/1MSG1DN458vUafEhYZH30eEHotJsy2e1B/view?usp=drive_link,2025-03-18T22:13:21.000Z
107,MCP Workflow Setup,"Ultimate No Code MCP Setup Guide (Self-Host, Installation, Common Issues)","In this detailed setup guide, Nate Herk walks you through deploying a self‐hosted MCP system using n8n’s community nodes. The video demonstrates installing the MCP community node via a free GitHub repository, configuring connections to various MCP servers, and integrating tools like Airbnb search, Brave search, and Airtable. It covers command execution with MPX, parameter handling, and environment variables to streamline automation without terminal commands, all backed by free resources.",Nate Herk | AI Automation,https://www.youtube.com/watch?v=OUPW4DJMAsA,https://drive.google.com/file/d/1D2_NfUDEWV7UIxUBci_7CR6kKlfwL-T9/view?usp=drive_link,2025-03-17T22:03:48.000Z
108,Website Chatbot,Add ChatGPT To Your Website In Minutes (n8n AI Chatbot),"In this video, Jono Catliff demonstrates a complete n8n workflow for adding an AI chatbot to a website. The system integrates an embedded chat trigger with an AI agent that uses OpenAI for responses and a secondary workflow for invoice generation, leveraging an HTTP request to communicate with Go High Level. The workflow includes dynamic data extraction (name and email collection) and a resume URL mechanism to continue execution after external processing. Free blueprints are provided via a Gumroad template.",Jono Catliff,https://www.youtube.com/watch?v=4VD-6dFQJsk,https://drive.google.com/file/d/1cGgIf2-fYp11MV5d3FhDSUuD1bgwCe5_/view?usp=drive_link  https://drive.google.com/file/d/1TeG1KpLru6o0b7CK78lmKECIpfNl3t4y/view?usp=drive_link ,2025-03-16T16:13:31.000Z
109,Twitter Data Scraper,How to Actually Scrape Twitter/X Data with n8n,"This system demonstrates an end-to-end workflow for scraping Twitter/X data using a free template shared by Nate Herk. It leverages the Twitter API with advanced search parameters, dynamic pagination using cursors, and a looping mechanism to extract tweet details such as IDs, URLs, content, likes, views, and dates. The workflow utilizes HTTP request nodes, code nodes for data parsing, and Google Sheets for data storage, all orchestrated within an automated n8n environment.",Nate Herk | AI Automation,https://www.youtube.com/watch?v=lEo7IAgj0UY,https://drive.google.com/file/d/1Zg5rvw2q9PV437VzxjAhLp7eWrHM9YqD/view?usp=drive_link,2025-03-15T01:37:17.000Z
110,Scraper Agent,This n8n Agent can scrape ANYTHING (no code),"This workflow is a no-code scraping AI agent built in n8n by Rory Ridgers. It integrates multiple tools to scrape data from LinkedIn, Google Maps, Trustpilot, and websites. The system uses Telegram triggers for user input, HTTP request nodes to interact with Apify actors for scraping, and a secondary workflow for converting HTML to markdown with a TAV API integration. It also features an OpenAI chat model with a buffer memory. The free template is available via Commonous.",Rory Ridgers,https://www.youtube.com/watch?v=TDB-St0V5vM,https://drive.google.com/file/d/1LuHzN-7UETUS2XeIR5KLort05KV1UXEm/view?usp=drive_link  https://drive.google.com/file/d/1IpqzqaQTf2ublU2SiuLsqlpsyrQ3-X_j/view?usp=drive_link  https://drive.google.com/file/d/1nPKpOw4bYc37MR4ItNb7MqVEaCsDtYeZ/view?usp=drive_link ,2025-03-14T18:58:09.000Z
111,Local AI Cloud Deployment,Create Your Own Private Local AI Cloud Stack in Under 20 Minutes,"Cole Medin demonstrates a full cloud deployment of a local AI stack, integrating LLM (Ollama), databases (Supabase, Qdrant), automation agents (n8n with Flowise), local search (SearXNG) and a user interface (Open WebUI). The setup uses Docker containers, secured endpoints via Caddy, and detailed firewall/DNS configurations for subdomains. This free, open-source system extends an original n8n template and is available on GitHub for immediate use.",Cole Medin,https://www.youtube.com/watch?v=hKrl5Gr7hM0,https://drive.google.com/file/d/1s94exFWhqQeFSxvvNPsm9i12LwpyVdLD/view?usp=drive_link,2025-03-13T00:00:40.000Z
112,Faceless Shorts Automation,How I Automated Faceless Shorts with AI in n8n (free template),"Creator Nate Herk presents a comprehensive AI-powered workflow that automates faceless shorts production. The system uses a Google Sheets trigger for content ideas, an agent for generating detailed image and sound prompts, and integrates multiple APIs including Pi API (flux image generation), Runway (video synthesis), 11 Labs (audio creation), and Creo mate for final video rendering. The result is a fully automated process that uploads generated videos to YouTube.",Nate Herk | AI Automation,https://www.youtube.com/watch?v=Gc03J27xmBc,https://drive.google.com/file/d/1kaelJeo5Th8d_gW43NmlFq4JBFSvzWd-/view?usp=drive_link,2025-03-12T05:28:07.000Z
114,Agentic RAG Workflow,Store All Data Types with Agentic RAG in n8n,"This n8n workflow implements an Agentic Retrieval Augmented Generation (RAG) system that processes diverse data types using a Superbase vector database and SQL queries for tabular data. The system dynamically retrieves, embeds, and aggregates PDF content and structured sales data while using file content fetching and error-handling nodes. Built by Nate Herk with a featured template by Cole, it offers a robust, free automation template to enhance AI agent reasoning before querying.",Nate Herk | AI Automation,https://www.youtube.com/watch?v=BhGaGFH0jR4,https://drive.google.com/file/d/1Vw3_4cDrwjTSN3pEpZ14EKntDdOJGZ0D/view?usp=drive_link,2025-03-08T20:04:37.000Z
115,Viral Content AI,I Built an AI SYSTEM For Viral Content (n8n Tutorial),"This system is a complete workflow that automates the analysis of viral Instagram Reels and other social media videos. It scrapes data from Instagram using Apify, organizes influencer data from Airtable, and then processes video content through Google Gemini AI for detailed analysis of hooks, ideas, and scripts. The workflow is set up in n8n and is designed for content creators and agencies. Created by Oleg Melnikov, the system is available as a free template.",Oleg Melnikov,https://www.youtube.com/watch?v=zEzcwjZf7c8,https://drive.google.com/file/d/17qrwc62-4CH6SfjD4-PORhcmpjWbVwgE/view?usp=drive_link,2025-03-06T04:41:32.000Z
116,Local AI RAG Agent,The ULTIMATE n8n RAG AI Agent Template - Local AI Edition,"Creator Cole Medin details a local agentic RAG AI workflow built with n8n. The system enables offline, secure Retrieval Augmented Generation by triggering file ingestion (PDF, CSV, text), extracting content, splitting text, and storing document data in PostgreSQL. It integrates SQL query capabilities for tabular data and uses Ollama for local LLM processing, alongside voice API tools like Cartesia. The free GitHub template offers a complete no-code solution for advanced document automation.",Cole Medin,https://www.youtube.com/watch?v=T2QWhXpnT5I,https://drive.google.com/file/d/152Q2fgzduqmE1EpjadZu8WkwGtLtcYrU/view?usp=drive_link,2025-03-06T01:00:18.000Z
117,Google Sheets Automation,Google Sheets on Autopilot: 11 Insane n8n Automation Hacks,"This video showcases a comprehensive automation workflow that integrates Google Sheets with n8n. The system uses triggers, webhooks, filters, and conditional logic to detect changes, update or append rows, and implement inline functions for calculations. It also demonstrates AI integration using ChatGPT for auto-classification and error handling, all while addressing rate limiting issues. The free blueprint template provided via Gumroad by Jono Catliff is featured throughout the tutorial.",Jono Catliff,https://www.youtube.com/watch?v=c8D1PP2erbo,https://drive.google.com/file/d/1FrH_-Qenv9ZaIQ3A7T-MAfqhAu-JEQwD/view?usp=drive_link,2025-03-03T20:13:50.000Z
