,name,title,description,creator,youtube_url,template_url,date_posted
44,AI Content Idea Generator,"1,200+ Content Ideas Per Day with AI (Free Template)","This workflow automates content ideation by scraping YouTube comments via an HTTP request to an Appify actor, then processing them with AI nodes using OpenAI models. It filters and extracts comments containing content ideas, performs real-time research via a Tavi integration, and finally updates the results in Google Sheets. Built entirely in n8n with robust JSON data handling and API integrations, this free template is created by Nolan Harper.",Nolan Harper | Ai Automation,https://www.youtube.com/watch?v=Xno2IGHfSDo,https://drive.google.com/file/d/1bLDkLPbiK11yjYvcUWxLTVGZZyiHg2gM/view?usp=drive_link,2025-05-05T16:00:59.000Z
45,Deep Cold Email Outreach,I Deep-Personalized 1000+ Cold Emails Using THIS AI System (FREE TEMPLATE),"In this video, Nick Saraev demonstrates a comprehensive workflow that automates the personalization and sending of 1000+ cold emails using a free AI system built in n8n. The setup integrates tools like Apollo for lead data, Apify for scraping, Instantly for email delivery, and Google Sheets for data management. It employs HTTP requests, HTML extraction, markdown conversion, and OpenAI’s GPT-4.1 to generate highly tailored icebreakers, making it an end-to-end, robust cold email automation system.",Nick Saraev,https://www.youtube.com/watch?v=oAWe5wFwHlo,https://drive.google.com/file/d/1mEJe6n3ohryVRm58sCBqfO5kyh-r49fb/view?usp=drive_link,2025-05-05T07:11:46.000Z
46,Marketing Automation Agent,This marketing agent automates EVERYTHING (free n8n template),"Rory Ridgers presents a free template for a marketing automation AI agent built in n8n. This workflow scrapes Google via Tavi and Instagram via Ampify to gather current social media and news data. Multiple LLM agents are used to summarize content, plan blog posts and social media updates, generate images through a GPT image generation API, and update results to Google Sheets and Google Drive. The system also includes integration with a custom web hook interface via Commonous Agents.",Rory Ridgers,https://www.youtube.com/watch?v=7TUPVDIcD3k,https://drive.google.com/file/d/1pLK1tuB8EOPLEeGIshFrlXGJFffduwVx/view?usp=drive_link,2025-05-04T20:36:54.000Z
47,Agent Tracking System,How I Auto Track AI Agent Actions and Token Usage (n8n tutorial),"This system provides a comprehensive workflow to track AI agent actions and token usage within an n8n setup. The tutorial details how to log initial inputs, intermediate steps, API calls, tool integrations (such as sending emails, retrieving contacts), and error handling into a Google Sheet using JavaScript nodes. Creator Nate Herk explains both the success and error branches, detailing cost calculations and observability, and offers a free downloadable JSON template via his Skool community.",Nate Herk | AI Automation,https://www.youtube.com/watch?v=vVdS-ZEFf50,https://drive.google.com/file/d/10WibhA7rvZoFvyS3ywOK9xy9dRJvXK_p/view?usp=drive_link,2025-05-03T18:51:28.000Z
48,Carousel & Slides Automation,This n8n AI Agent will AUTOMATE your Carousels and Slideshows 🍄,"This system automates the creation and posting of carousels and slideshows for various social media platforms. It uses a fully configured workflow in n8n, featuring an AI agent powered by ChatGPT for generating quotes and image prompts, and integrates with the Blotato API to generate and publish content. The automation supports scheduling, structured output parsing, and multi-platform publishing including Instagram, TikTok, Twitter, and more. Creator Sabrina Ramonov offers a free template for direct import.",Sabrina Ramonov 🍄,https://www.youtube.com/watch?v=Ev3xBsldyBk,https://drive.google.com/file/d/1ScC7DzKkVN8nLUzBuf7gNedagumbCXne/view?usp=drive_link,2025-05-03T18:10:35.000Z
49,Proposal Generator,My $27K/m Ai Proposal System in n8n (Free Template),"In this video, Nolan Harper demonstrates a comprehensive AI-driven proposal generator system. The workflow automates the creation of personalized sales proposals by using form triggers (via JotForm), Google Drive for template management and file conversion, and OpenAI for transcribing sales call recordings and generating dynamic content. The system integrates multiple nodes in n8n to seamlessly pull data, update documents, and send PDF proposals, all available with a free template.",Nolan Harper | Ai Automation,https://www.youtube.com/watch?v=FTaTMj0u0II,https://drive.google.com/file/d/1RFt5KLTFdzjIuhCWJ3SsxVMFNYK2Voi5/view?usp=drive_link,2025-05-02T17:25:04.000Z
50,Google Map Scraper,Scrape Unlimited Leads WITHOUT Paying for APIs (99% FREE),"This system scrapes email leads from Google Maps using a free n8n workflow. It leverages HTTP request nodes for fetching Google Maps search results, custom JavaScript with regex (reax) for parsing URLs and emails, and filtering nodes to remove unwanted domains and duplicates. The workflow also integrates loop and wait nodes to manage rate limits and extracts data from Google Sheets. Built by Nick Saraev, it provides a comprehensive, automated lead scraping solution.",Nick Saraev,https://www.youtube.com/watch?v=OroDNJl-pyc,https://drive.google.com/file/d/1Kxsl2-sbZGKPqY_X2nluN6aujuTqbcux/view?usp=drive_link,2025-05-01T03:13:25.000Z
51,Dynamic AI Agent Workflow,"This AI Agent Picks Its Own Brain (10x Cheaper, n8n)","Created by Nate Herk, this no-code system uses a Slack trigger to dynamically select the best large language model based on user input. The workflow routes tasks to free or cost-effective models (e.g., Gemini 2.0 Flash, GPT 4.1 Mini, Claude 3.7 Sonnet) via OpenRouter. It integrates logging with Google Sheets and employs Superbase for RAG-based document querying, optimizing performance and cost. Free template resources are available through the Skool community.",Nate Herk | AI Automation,https://www.youtube.com/watch?v=gwCQF--cARA,https://drive.google.com/file/d/1bI39O_RM8Kq7F0zfWALQdW6DjITh6m3w/view?usp=drive_link,2025-04-30T18:54:47.000Z
52,LeadGen Outreach,Automate Lead Generation and Email Personalization in Minutes with n8n! (Free Template),"This workflow automates lead generation and personalized email outreach in a two-step process. It sources leads from Apollo via an HTTP actor (using Epifi) and filters, deduplicates, and maps data into Google Sheets before passing it to an AI agent powered by OpenAI for personalized email drafting. A schedule trigger controls email dispatch limits. Created by Mahmut Kasimoglu | AI Automation, the free template is available via his Skool community.",Mahmut Kasimoglu | AI Automation,https://www.youtube.com/watch?v=ZD2DlnuqCrA,https://drive.google.com/file/d/1ENxEyIhlHwtUCq5zyrCw6lDTFjksFlcz/view?usp=drive_link,2025-04-28T19:48:04.000Z
53,Product Videography,How I Automated Product Videography with AI (Step by Step n8n Tutorial),"This workflow automates product videography by capturing a product photo, title, description and email via a form trigger. The system uploads the image to Google Drive, then uses an AI agent (via OpenRouter with GPT-4.1) to generate a text image prompt. It processes the image with OpenAI's image edit API, converts the result and hosts it on ImageBB, and finally, uses the Runway API to generate a 10-second video before sending the outputs via Gmail. Created and demonstrated by Nate Herk, free template resources are available in his Skool community.",Nate Herk | AI Automation,https://www.youtube.com/watch?v=qV7xOEKEBDA,https://drive.google.com/file/d/1jtRDbCceuf1h6J52kU7lZJS8q1LKHusP/view?usp=drive_link,2025-04-28T18:56:18.000Z
54,Cold Email Automation,"AI System Writes 10,000+ Personalized Cold Emails (Free Template)","This system is a no-code AI automation workflow for personalized cold email outreach. It scrapes prospect data using an Apollo integration, processes the data with HTTP and Google Sheets nodes, and employs an AI agent (via ChatGPT) to generate custom, human-like email icebreakers. The automation then sends the enriched leads into a cold email campaign using Instantly. Created by Nolan Harper, the template is available for free in his AI Automation Vault.",Nolan Harper | Ai Automation,https://www.youtube.com/watch?v=2Utdn12JSK4,https://drive.google.com/file/d/1SzkKEMV6mdMLltG_ZA7W0lT2lng7pszn/view?usp=drive_link,2025-04-28T17:18:16.000Z
55,Lovable Web App Builder,This Lovable + n8n Hack Builds Web Apps FOR You In Minutes (No Coding),"This workflow leverages Lovable’s natural language coding tool integrated within an n8n automation to create custom web applications in minutes. The system uses webhook triggers, HTML scraping for website content cleanup, and API calls like Dolly3 for image generation and OpenAI for text creation. User inputs such as company name, industry, and website URL are processed to dynamically generate tailored social media posts. The free blueprint template, provided by creator Jono Catliff, allows users to import and run the complete workflow immediately.",Jono Catliff,https://www.youtube.com/watch?v=i08K-l8pjfs,https://drive.google.com/file/d/1g1By_B5MBr1R7KDdHvN4NHAaf9Ysmi8g/view?usp=drive_link,2025-04-28T17:05:23.000Z
56,Marketing AI Team,I Built a Marketing Team with 1 AI Agent and No Code (free n8n template),"This system builds an all-in-one AI marketing team using no-code automation. The workflow integrates multiple AI agents that create and edit images, generate LinkedIn posts, blog articles, and video content automatically via a Telegram interface. It leverages OpenAI’s image and editing endpoints, Google Drive and Sheets for logging, external APIs like Runway and CreativeMate for video rendering, and Flux image generation via HTTP requests. Created by Nate Herk, the video provides a free template through a Skool community resource.",Nate Herk | AI Automation,https://www.youtube.com/watch?v=ldETapkr8Hg,https://drive.google.com/file/d/1a9FskKLV_AgxUNPgb_CUOLKke97Ox3Sx/view?usp=drive_link https://drive.google.com/file/d/1WEWSJJZmMCg_Ii4U2I0fO-2xJwil_bVL/view?usp=drive_link https://drive.google.com/file/d/171-HNdf_RkGeVTZQppEANBzjRT8f42Ij/view?usp=drive_link https://drive.google.com/file/d/152aOdjNfmL--KpXTFj1m5Bw-mQkLI8N3/view?usp=drive_link https://drive.google.com/file/d/1yT36iHGZKk0mYLVvLnEgFDE87Tcr3Ore/view?usp=drive_link https://drive.google.com/file/d/1dN1KqlBJZsps_ww5sH2oSvl420AtjYY7/view?usp=drive_link https://drive.google.com/file/d/11OdlUx1lpDR57BFgWKRl0Nq795Au7f4b/view?usp=drive_link ,2025-04-26T19:39:40.000Z
57,Faceless Video AI,This EASY AI Agent System Creates Faceless Videos on Auto Pilot! (Free n8n and Make templates 🍄),"This system automates the creation and publishing of faceless videos via an AI agent workflow. It uses an initial node to brainstorm and write video scripts, then calls a unified API to generate AI videos with voiceovers, images, and animations. The workflow further includes steps for video rendering and publishing on social media. Developed by Sabrina Ramonov, this free template integrates various AI and API services for seamless content automation.",Sabrina Ramonov 🍄,https://www.youtube.com/watch?v=0qf0blCB4Mc,https://drive.google.com/file/d/1OcC7yl7UGsEJbK2Sty0GiNxKAX0jlJX4/view?usp=drive_link  https://drive.google.com/file/d/1q6rJa6kudBtTTxeZKfwRT_F2PcTHGONa/view?usp=drive_link ,2025-04-26T16:34:07.000Z
58,Image Creation and Editing System,This n8n Agent Creates & Edits Images with OpenAI’s New Image API,"This system is a complete workflow built in n8n that integrates with OpenAI’s new Image API for generating and editing images via natural language prompts. It includes three subflows: one to create images using models like gpt-image-1 (with support for Dolly 2 and Dolly 3), one to edit images by referencing existing assets, and one to log details in Google Sheets. The automation features an AI agent that smartly routes commands based on context and converts images to Base64 for Google Drive storage. Created by Mark Kashef, it offers a free downloadable template for immediate use.",Mark Kashef,https://www.youtube.com/watch?v=YqEtFVAV7M8,https://drive.google.com/file/d/1-J4bR_Xx6v_eBNqLV9-dEMNf4b9qz1p2/view?usp=drive_link  https://drive.google.com/file/d/1ZPOll5ZvYVvir_84JZSaSDtWwi6nn0zr/view?usp=drive_link  https://drive.google.com/file/d/1-3_hYyaIYBZPDdLkaTVVTM4-H4Yg75ll/view?usp=drive_link  https://drive.google.com/file/d/1P1fq0hB2v2156GqlX7DEevxXkrvDOaff/view?usp=drive_link ,2025-04-25T18:03:51.000Z
59,Viral Shorts Automation,I Built an AI SYSTEM For Viral Faceless Shorts (n8n),"This system is a fully automated AI pipeline designed to create viral faceless shorts. It uses scheduled triggers to pull data from Google Sheets, generate fresh content ideas through chat-based AI, and produce visuals with PI API (16:9 aspect ratio). Videos are created via runway ML (using gen3/4 models), merged with CreateTomate, and finally published on YouTube through Google Cloud’s API integrations. Developed by Oleg Melnikov, the workflow is available as a free template.",Oleg Melnikov,https://www.youtube.com/watch?v=oMcLgseGER0,https://drive.google.com/file/d/1tKfWJp_sYJkF-evhwWfJ8PZtgKIKBfqV/view?usp=drive_link,2025-04-25T12:48:27.000Z
61,AI Image Automation,Use OpenAI’s NEW Image Generation API with n8n to create stunning images (Step by Step Tutorial),"MagicOps AI demonstrates a workflow that connects OpenAI’s new image generation API with an automation platform to create stunning visuals. The system uses HTTP request nodes to call the API, processes Base64 strings to convert images to files, and integrates Google Drive for storage. It supports both text-to-image and image-to-image transformations for generating recipe images and enhancing product photos. Free template available via Gumroad.",MagicOps AI,https://www.youtube.com/watch?v=SAUxo5fcLMs,https://drive.google.com/file/d/1t4D_qE2hlc-ao6Fi0U2Zo1L3UvLwWgA8/view?usp=drive_link,2025-04-24T13:00:31.000Z
62,Customer Support Automation,Build a No-Code AI Customer Support System That ACTUALLY Works,"This video details a comprehensive no-code automation system for customer support built using n8n. The workflow integrates community posting (using Circle), a ticketing dashboard via Airtable, and an AI agent that leverages a search tool and perplexity API to provide tailored responses. The system automatically creates, updates, and resolves support tickets, ensuring efficient status tracking. Developed by Ben AI, it features HTTP webhooks, API calls, manual mapping, and automated status updates for real-time support.",Ben AI,https://www.youtube.com/watch?v=mJwZPK2A7cM,https://drive.google.com/file/d/1VVhH-po9vp3OWewlxNAuCNWnAZQD1Dmi/view?usp=drive_link,2025-04-24T05:32:46.000Z
63,LinkedIn Visual Automation,"OpenAI's Image API Just Changed the Game (save 10+ hours/week, n8n tutorial)","In this workflow, Nate Herk demonstrates a comprehensive AI automation system for marketing on LinkedIn. The process begins with a form submission gathering email, post topic, and target audience, and then uses two AI agents: one to generate a research-backed post and another to convert it into a dynamic image prompt. The system integrates the OpenAI Image Generation API, Tavi for web search, and HTTP request tools for API calls along with binary conversion. A free template is available via his Skool community.",Nate Herk | AI Automation,https://www.youtube.com/watch?v=ACkHpQQnfxQ,https://drive.google.com/file/d/1dbB79dIiKGkotbZcPNVk4pNPoczN_vnj/view?usp=drive_link,2025-04-23T23:56:03.000Z
65,Inbox Automation,Automate Your Inbox With n8n (No Code),"This video by Nolan Harper from the AI Automation Vault details a no-code workflow to automate email management. The system uses a Gmail trigger to monitor incoming mails, a text classifier to route emails into categories like promotions, internal, customer support, and sales, and integrates OpenAI models for drafting AI responses. It also leverages Slack for notifications and uses a free template available via the AI Automation Vault for seamless replication.",Nolan Harper | Ai Automation,https://www.youtube.com/watch?v=UDXDcFwAPQU,https://drive.google.com/file/d/17OYXI08wdcgIWDf-WqJ_v-V9AHRqBMrP/view?usp=drive_link,2025-04-21T17:00:38.000Z
66,Error Logger Workflow,One n8n Workflow for Unlimited Error Handling (Step-by-Step),"In this detailed video tutorial, Nate Herk from AI Automation demonstrates a precise error logging system built within n8n. The workflow uses a global error trigger that funnels errors from various active workflows into a dedicated error logger, which appends data like timestamps, workflow names, workflow URLs, node names, and error messages into a Google Sheet. It also sets up notifications via Slack and other channels. The free Google Sheet template is available by joining Nate Herk’s Skool community.",Nate Herk | AI Automation,https://www.youtube.com/watch?v=bTF3tACqPRU,https://drive.google.com/file/d/1_EF3ESE9zRSrFNVgMwhMcTm23JwYzWLW/view?usp=drive_link,2025-04-20T16:52:54.000Z
67,Think Tool Agent,n8n Just Dropped a Game-Changing Tool for AI Agents — Inspired by Anthropic!,"This video by Mahmut Kasimoglu explains a dedicated workflow that leverages the new Think tool – a scratchpad feature inspired by Anthropic – to enhance AI agent reasoning in multi-step processes. The system integrates a personal assistant agent that simulates tools such as email, calendar, CRM, and Slack, and employs tailored prompts and system instructions to improve execution reliability and planning. The workflow is available as a free JSON template in the free Skool community.",Mahmut Kasimoglu | AI Automation,https://www.youtube.com/watch?v=MPyQWs8dOpI,https://drive.google.com/file/d/1SNpBbNphUAmjSJRDEdJ-YO_VTkoMGJ2A/view?usp=drive_link,2025-04-19T17:23:22.000Z
68,Meta Ad Automation,How we Automated a Meta Ad Agency with AI,"Ben AI demonstrates a comprehensive automation workflow for a meta ad agency that streamlines product research, ad angle creation, script generation, and performance tracking. The system integrates Airtable, the Facebook Graph API, Scrapfly web scraping, and AI services such as Perplexity and Google Gemini 2.5 Pro. Using webhooks and multi-phase processing in n8n, it optimizes ad campaigns by analyzing ROI, making it a powerful, fully automated solution. Template provided by Ben AI.",Ben AI,https://www.youtube.com/watch?v=Rm3ObJXsuOI,https://drive.google.com/file/d/1mkQLWY1YS59RNuFR7Q8d-GKwk34FlwQz/view?usp=drive_link,2025-04-19T06:21:26.000Z
69,Automated Hiring Workflow,How I Automated the Entire Hiring Process with n8n,"This system automates the entire hiring process by integrating email triggers from Indeed with Gmail, Google Sheets, and cal.com. It leverages an OpenAI agent to extract job titles from unstructured email subjects and uses custom Google Apps Script to sync candidate data while dynamically routing stages—from initial application and onboarding to screening, testing, and interview scheduling. Created by Jono Catliff, this workflow blueprint is provided as a free template.",Jono Catliff,https://www.youtube.com/watch?v=dBTrOcWkYM0,https://drive.google.com/file/d/1qm916r1TGLBihsGOGJRMx_asQVyiKprd/view?usp=drive_link,2025-04-18T23:40:40.000Z
70,Email & Complaint Automation,Don’t Build Another AI Agent Until You Understand This: AI Agents vs AI Workflows ~ n8n,"In this video, Mahmut Kasimoglu demonstrates two specific n8n systems built for automation: an email labeling system and a complaint ticket processing system. Both systems show a direct comparison between an AI agent approach and an AI workflow approach. The email system uses a Gmail trigger, LLM-based classification, tool calls to get label IDs, label emails, and send notifications, while the complaint system integrates Google Sheets and email notifications. A free template for these workflows is available via his Skool community.",Mahmut Kasimoglu | AI Automation,https://www.youtube.com/watch?v=nQbd56j_dZ0,https://drive.google.com/file/d/1TDMcJcOcdzCXNFv-_T-CBNzLWli14SDD/view?usp=drive_link,2025-04-18T20:21:05.000Z
71,MCP Integration,n8n Just Released MCP - Is It The Future of AI & No Code?,"This video demonstrates a complete MCP integration workflow that leverages a dual-flow setup with an MCP client and MCP server trigger. The system enables communication between AI agents (like Claude and OpenAI) and external tools (Google Sheets, Google Calendar) via SSE endpoints, tool discovery, and auto-generated schemas. The blueprint and free template allow users to import a ready-made automation for AI-driven tasks. Creator: Jono Catliff.",Jono Catliff,https://www.youtube.com/watch?v=Nw0v1-24x5w,https://drive.google.com/file/d/1a32FZaRDmUr8f8ah63rpl2z0cn0atbTn/view?usp=drive_link  https://drive.google.com/file/d/1PtaM-y2dzyD2JzhTecr9hNI0Q1QtwXV_/view?usp=drive_link ,2025-04-18T00:39:56.000Z
72,AI Think Agent System,n8n Just Leveled Up AI Agents (Anthropic's Think Method),"In this video, Nate Herk demonstrates an AI agent workflow that leverages a new Think Tool inspired by Anthropic’s structured reasoning approach. The system integrates multiple agents—including contact, email, calendar, and web search tools—to execute multi-step tasks such as scheduling events, sending notifications, and fetching quotes. It highlights advanced LLM integrations (e.g., GPT 4.1 and Claude 3.5) and tool output analysis for sequential decision-making with in-built validation steps. The free template is available via the Skool community.",Nate Herk | AI Automation,https://www.youtube.com/watch?v=WqyLxyALTt0,https://drive.google.com/file/d/1zCMh9PYMXoWbEntB6Oq00IlMgmZQ6B2Z/view?usp=drive_link,2025-04-17T01:24:11.000Z
73,WhatsApp AI Agent,How to add AI Agents to WhatsApp using n8n (Step-by-Step Guide),"This video presents a comprehensive WhatsApp AI agent workflow built entirely using n8n. The system integrates the WhatsApp Business Cloud API with Meta Developer platform setup, leveraging OpenAI for voice transcription, image analysis, and natural language processing. It handles text, image, and audio inputs with custom routing using switch nodes, and includes features like conversation memory and real-time web search. The creator, Leon van Zyl, also offers a free downloadable workflow template via GitHub.",Leon van Zyl,https://www.youtube.com/watch?v=LekI91ISf_8,https://drive.google.com/file/d/1qp0uJFG9h6Ps6mHWqhdIbdweg6gdJKWZ/view?usp=drive_link,2025-04-16T13:57:52.000Z
74,Claude MCP Content Automation,"Automate Anything With Claude MCP Workflows, Here's how:","Ben AI demonstrates a robust automation system that integrates Claude MCP workflows with n8n for content repurposing. The system uses cloud triggers to orchestrate a series of tools: YouTube transcription, fine-tuned LinkedIn post generation, dynamic image creation via external APIs, and Air Table/Webflow updates. The workflow is designed for social media and blog content automation with human-in-loop iterations, offering a detailed, step-by-step solution. Free template available.",Ben AI,https://www.youtube.com/watch?v=_je0FbUcFkg,https://drive.google.com/file/d/1gow-LHalspkMCuQCI7xp580C4LbTThbx/view?usp=drive_link  https://drive.google.com/file/d/1uqYk4jyWDpcSeUbeWO0JnqYEnvqeDQs8/view?usp=drive_link  https://drive.google.com/file/d/1OBNRFIscIzI16NscMGZk259fYCXbOmZ5/view?usp=drive_link ,2025-04-16T07:41:58.000Z
75,Social Media Scraper,Steal This AI Post Scraper (Free n8n Build),"This system automates scraping of posts and video transcripts from multiple social platforms including LinkedIn, Instagram, YouTube, and X. Built entirely in n8n, it integrates HTTP request nodes, AI text classification, and Google Sheets for deduplication and data aggregation. The workflow leverages pre-built Appify scrapers and looping mechanisms for batch processing. Created by Nolan Harper, this free template enables competitor research, content repurposing, and audience insights.",Nolan Harper | Ai Automation,https://www.youtube.com/watch?v=fhxqdoP7ivE,https://drive.google.com/file/d/14m6BvV1jlPb5_Esv_CRCfM9K3bDmCc3M/view?usp=drive_link,2025-04-14T17:00:49.000Z
76,Invoice Tracker,Automate Invoice and Expense Tracking with Gemini | BULLETPROOF!,"This system automates invoice and expense tracking by processing receipts through a detailed workflow that integrates file upload via a form trigger, Google Drive for storage, and Gemini AI for file analysis. The flow splits file packages into individual items, leverages HTTP requests to Gemini endpoints for metadata extraction, and uses conditional logic with a switch component to update Google Sheets and send Slack notifications. Built and demonstrated by MagicOps AI, this video provides a free n8n template to get you started.",MagicOps AI,https://www.youtube.com/watch?v=j9_gps_ZZNU,https://drive.google.com/file/d/1uEbC2YozSiDhGH2v_o8LgpLmJGdq1U_Z/view?usp=drive_link,2025-04-14T13:39:13.000Z
77,Website Extractor,Turn Any Website Into LLM Ready Data in Seconds with n8n & Firecrawl,"This system transforms any website into LLM-ready data using an n8n workflow integrated with Firecrawl. The workflow demonstrates how to initiate HTTP requests, perform intelligent extraction with a custom prompt, and handle asynchronous status checking with polling. It leverages wildcards to crawl multiple pages, incorporates header-based API key authentication, and uses JSON processing to parse quotes and authors from a target website. Created by Nate Herk | AI Automation, the free template is available via his Skool community.",Nate Herk | AI Automation,https://www.youtube.com/watch?v=Ee9WtEEd300,https://drive.google.com/file/d/1a5dDs4QXa4e7aCt7QErpadewvHBB7Pm_/view?usp=drive_link,2025-04-13T17:12:58.000Z
