,name,title,description,creator,youtube_url,template_url,date_posted
0,Podcast Clip Automation,Generate 100s of Viral Podcast TikTok Clips & Reels with This AI System,"This system automates the conversion of long-form podcast episodes into engaging short-form clips for TikTok, Instagram, and YouTube. It’s built entirely in n8n and integrates multiple tools: an RSS feed for scraping, the Visard API for automated video clipping, OpenAI for generating compelling captions, Google Sheets for data logging, and Gmail for notifications. The workflow processes content detection, highlight extraction, and clip generation autonomously. Created by Nick Saraev, this free template provides a complete, ready-to-run solution for social media content repurposing.",Nick Saraev,https://www.youtube.com/watch?v=yueOIxkDig0,https://drive.google.com/file/d/1GSHGp8PUI_7ZV8YXoollecxA7JdOLMt0/view?usp=drive_link,2025-07-02T06:46:01.000Z
1,AI Resume Screening System,Watch Me Build an AI Resume Analysis System in 28 minutes (no code),"In this tutorial, Nate Herk builds a no-code AI resume analysis system using n8n. The workflow integrates Gmail triggers to capture resumes, uploads and converts files in Google Drive (handling Word docs, PDFs, and text files), extracts content, and leverages an AI agent with OpenAI’s chat model to analyze candidate strengths, weaknesses, risk/reward, and overall fit. The output is structured and then pushed to Google Sheets. A free workflow template is available via his free Skool community.",Nate Herk | AI Automation,https://www.youtube.com/watch?v=M0s6O8xtVUE,https://drive.google.com/file/d/1dFPQN0ydpHBKzSHLg31eKA8Tv0GtmW_R/view?usp=drive_link,2025-06-30T17:00:55.000Z
2,RAG Agents Workflow,n8n Just Leveled Up RAG Agents (Reranking & Metadata),"This system demonstrates a no-code AI agent that enhances vector-based document retrieval with a Cohere-powered re-ranker and metadata filtering. It uses a Superbase vector database to store chunked data and dynamically applies metadata filters for targeted queries. The workflow refines results by reranking returned chunks, ensuring accurate extraction of rule-based content. Developed by Nate Herk, the system is available via a free template in his Skool community.",Nate Herk | AI Automation,https://www.youtube.com/watch?v=xWhX61651H8,https://drive.google.com/file/d/1ee6skeDuBnYYV_9thU9bCnwYgc1sM-Ii/view?usp=drive_link,2025-06-28T14:52:09.000Z
3,PPC Thievery,can't believe i built a $70k ai creative team in 66mins using only N8N,"This system, created by Nick Saraev, is an end-to-end PPC automation workflow that scrapes high-performing ads from the Facebook Ad Library using an API (via Appify) and then processes the assets with AI. It leverages modules for HTTP requests, Google Drive for file storage and organization, Google Sheets for logging, and OpenAI for image analysis and creative prompt generation. The workflow transforms scraped ad components into customized creative assets. Free template available.",Nick Saraev,https://www.youtube.com/watch?v=GNmlnt52aSM,https://drive.google.com/file/d/1ka5OJF-1NWZdM0aM0VA8lZ9AJYvh2cnP/view?usp=drive_link,2025-06-28T05:30:09.000Z
4,Meeting Prep Automation,This n8n Automation Does ALL My Meeting Prep While I Sleep,"Mark Kashef demonstrates an advanced automation workflow that converts Calendly bookings into tailored AI-generated meeting prep audio files. This system captures booking details and uses the Perplexity API for deep research on both the attendee and their company. It then consolidates insights using OpenAI’s o3-mini for reasoning and text-to-speech for audio generation, before sending a personalized email via Gmail. The free template is available via Gumroad for immediate use.",Mark Kashef,https://www.youtube.com/watch?v=9HBa364RZBk,https://drive.google.com/file/d/1vH6R5eVJJGNTgDB88ZCkfyKqUgrFkY_q/view?usp=drive_link,2025-06-27T18:20:17.000Z
5,YT Strategist Agent,I Built a YT Strategist AI Agent That Makes Me $6k/mo (free template n8n),"This system is a fully automated YouTube strategist workflow built in n8n that scrapes and analyzes YouTube channels to extract top-performing videos from niche channels, analyzes titles for power words, evaluates thumbnails using OpenAI, and aggregates viewer comments for insight. It combines scheduled tasks (weekly and daily) with API integrations via Appify and Google Sheets to generate actionable video ideation and packaging. Developed and demonstrated by Nate Herk, this free template offers a complete guided setup for creating a data-driven content strategy.",Nate Herk | AI Automation,https://www.youtube.com/watch?v=Ch-AWxvX2Jc,https://drive.google.com/file/d/1FnftwssvJBwXu9XNFnKnoKMj296a-w9r/view?usp=drive_link,2025-06-24T13:55:20.000Z
7,Client Onboarding System,I Built an AI System that Onboards Clients in 30 Seconds (Free n8n Template),"This system automates new client onboarding via a form-triggered workflow. It creates client folders in Google Drive, sets up project lists and tasks in ClickUp, and configures a dedicated Slack channel with personalized welcome messages. An AI agent parses proposal and scoping documents to extract actionable tasks with due dates. The integration leverages APIs for Google Drive, ClickUp, Slack, and Gmail. Creator: Nolan Harper.",Nolan Harper | Ai Automation,https://www.youtube.com/watch?v=gXKzEt1ZG38,https://drive.google.com/file/d/1jGUC5vcD2W0cOhtIfDwLGdMtMw4OuROY/view?usp=drive_link,2025-06-21T17:07:33.000Z
8,AI Agent Team Builder,I Built an AI Agent that Builds Entire Teams of AI Agents in n8n (free template),"This workflow is a no-code system built by Nate Herk that uses an AI agent to generate complete JSON-based automation flows on demand. It integrates Slack triggers, Gmail, Calendar, and Google Sheets for logging, using Anthropic’s Claude Opus 4 for natural language processing and output generation. The system provides detailed configuration via sticky notes, API integration, and a step-by-step setup guide, making it ideal for rapidly deploying custom automations.",Nate Herk | AI Automation,https://www.youtube.com/watch?v=Ik8OHT3w4pE,https://drive.google.com/file/d/1YidfszPBryjmb2nC1Eeig94X187bnYmq/view?usp=drive_link,2025-06-18T13:40:32.000Z
9,FB Ad Spy Tool,Build A Facebook Ad Spy Tool With N8N (Sell for $2k+),"This system is a fully automated Facebook Ads Scraper and Analyzer built on n8n by Nick Saraev. It uses Appify to scrape Facebook’s Ad Library and categorizes ads into video, image, and text types. The workflow integrates OpenAI’s GPT-4.5 for rewriting ad copy, Gemini API for video analysis, and stores data in Google Sheets. Intelligent filtering and dynamic routing ensure accurate ad analysis. A free template is provided via Gumroad.",Nick Saraev,https://www.youtube.com/watch?v=0PJNiDuihBg,https://drive.google.com/file/d/1whrqvO_wTk_NFhufCd3oqD0ZiSk9kaWI/view?usp=drive_link,2025-06-18T05:30:00.000Z
10,AI Video Analysis,The Simplest Setup for FREE AI Video Analysis (n8n + Google Gemini),"This video demonstrates a fully automated workflow that uses a no-code engine to perform video analysis via Google Gemini. The system supports both local file uploads and YouTube URLs, employing polling to monitor the status of the video processing. It covers technical details such as setting up Google API credentials, configuring HTTP requests with header parameters, handling binary video data, and prompting Gemini for detailed analysis (e.g., summarization, insight extraction). The template is provided free through Nate Herk's Skool community.",Nate Herk | AI Automation,https://www.youtube.com/watch?v=acB2o6nwAn8,https://drive.google.com/file/d/1UYTwp5P0zyz-kpZrQ6vlVH36d-zkPZSM/view?usp=drive_link,2025-06-12T15:38:50.000Z
14,Multi-Agent Orchestrator,"Multi-Agent Systems Have NEVER Been EASIER to Build (n8n, no code)","In this detailed demonstration, Nate Herk shows how to build a multi-agent orchestrator system using n8n's visual drag-and-drop interface. The workflow breaks down a complex task into specialized sub-agents (email, contacts, calendar, content creation) that communicate via sub-workflows, enabling robust task delegation. Key components include integration with Gmail, Airtable, and model selection (GPT-4.1 mini, Flash), all configured in n8n to provide a reusable, modular AI automation system.",Nate Herk | AI Automation,https://www.youtube.com/watch?v=0iUNOmeU7O4,https://drive.google.com/file/d/1fl1KfmH2DaQihE9-xTlQ52hoJ4CcPkzs/view?usp=drive_link,2025-06-10T17:59:27.000Z
15,Browser Agent,I Built the Ultimate Browser Agent with No Code (n8n + Airtop),"This system is a no-code browser agent that automates remote browser interactions using Airtop and OpenRouter. It leverages a workflow setup with tools to start browser sessions, load URLs, query DOM elements, perform click & type actions, and end sessions, mimicking human behavior. The agent can handle tasks such as scraping, interacting with authenticated websites, and executing dynamic searches. Created by Nate Herk, the setup includes a free JSON template available via his Skool community.",Nate Herk | AI Automation,https://www.youtube.com/watch?v=ar37oypyATQ,https://drive.google.com/file/d/1tPjnN9OmaaFDN3NOn7jduYqqTOR83nEH/view?usp=drive_link,2025-06-08T23:19:09.000Z
19,SMS AI Agent,How to set-up and build an SMS Ai Agent (free template),"In this system, Rory Ridgers demonstrates a workflow that builds an SMS-based AI agent using n8n. The solution integrates Twilio for SMS messaging, setting up a webhook to trigger the flow, and uses Google Sheets for temporary message buffering and context accumulation. The workflow incorporates wait nodes, code blocks, and Gmail API nodes for sending and receiving emails. A free template is available to replicate this specific SMS AI agent system.",Rory Ridgers,https://www.youtube.com/watch?v=_igpx9vXYvA,https://drive.google.com/file/d/1_FgNxEA1lw6tNcMgK8y7BLNmrsgtlvbf/view?usp=drive_link,2025-06-05T11:01:06.000Z
20,SEO Audit Webapp,Build Web Apps with Firebase Studio + n8n In 30 Mins (Beginner’s Guide),"This system builds a SEO audit web application using Firebase Studio and a free workflow that leverages webhooks to trigger an Appify-powered audit. The setup incorporates HTTP request modules, chat agents for grouping and formatting data, and an aggregator to merge SEO metrics from multiple pages into a dynamic dashboard. Created by Jono Catliff, the blueprint is available free via the provided Gumroad link.",Jono Catliff,https://www.youtube.com/watch?v=MCRF1914Fxs,https://drive.google.com/file/d/1KpjLcnmTArk39AAkGDw25QWECoMHEWB9/view?usp=drive_link,2025-06-04T23:15:32.000Z
21,Web Scraper Agent,This AI Agent Can Scrape and Screenshot the Web with No Code (n8n tutorial),"In this tutorial, Nate Herk demonstrates a no-code n8n workflow that leverages Firecrawl’s powerful search API to perform precise web scraping and full-page screenshots. The system integrates advanced query operators, including site filtering and keyword exclusion, via HTTP request nodes, and supports multiple output formats such as markdown, HTML, JSON, and full-page screenshots. Detailed steps for setting up API authentication using bearer tokens are provided. A free JSON template for this n8n workflow is available through the free Skool community resource.",Nate Herk | AI Automation,https://www.youtube.com/watch?v=3Pim6uCASSE,https://drive.google.com/file/d/1klYxj1CZI2sLFT_li6sUEJUESn4KIgSi/view?usp=drive_link,2025-06-03T13:30:22.000Z
22,YouTube Growth Automation,How I 14x’d My YouTube Channel in 7 Days (AI + n8n Workflow Breakdown),"This workflow system automates YouTube channel growth by researching trending videos, filtering by views and recency, and then generating improved video metadata. It combines a form trigger, HTTP requests to a YouTube scraper and transcript API, Google Sheets for data management, and OpenAI nodes for thumbnail analysis and title/outline generation. Built entirely in n8n, creator Nolan Harper shares his free template from the AI Automation Vault to help you replicate the success.",Nolan Harper | Ai Automation,https://www.youtube.com/watch?v=t6iPH93krzY,https://drive.google.com/file/d/1aX49kZzkWZDXayl7uzMmtSfNNOw7J2fk/view?usp=drive_link,2025-05-30T14:38:24.000Z
23,Lead Qualifier System,This Ai Phone Agent qualifies leads on Autopilot (free template),"This workflow ingests new lead submissions via a web form and automates end-to-end qualification. The system scrapes the lead’s website, converts HTML to markdown, and uses the Tavly API to fetch LinkedIn data which is then summarized using an LLM. The consolidated lead details are stored in an AirTable CRM before a Vapi-powered AI phone agent calls the lead to qualify them and schedule meetings via Google Calendar. Created and demonstrated by Rory Ridgers, the free template is included.",Rory Ridgers,https://www.youtube.com/watch?v=oU8K3i5KqEc,https://drive.google.com/file/d/1KQpLyRi9HymVoAaI0Pu8beaUZymDybYk/view?usp=drive_link https://drive.google.com/file/d/1kDrPhkIet9UZHxxbDp5CskVcHKP1rJK4/view?usp=drive_link https://drive.google.com/file/d/1DIIb0jkXCJ3L1idDtRt4vfsAnFvv4leq/view?usp=drive_link,2025-05-30T11:01:32.000Z
24,Google Workspace Setup,"Set Up Google Credentials In n8n In 5 Mins (Gmail, Drive, Sheets & More)","This workflow demonstrates a comprehensive integration of Google Workspace services including Gmail, Drive, Sheets, Docs, Calendar, and Slides through an automation platform. The video meticulously covers configuration in the Google Cloud Console, API enablement, OAuth consent setup, and creation of web application credentials using redirect URIs. Led by Jono Catliff, it provides a free, step-by-step blueprint template for securely connecting and automating Google APIs.",Jono Catliff,https://www.youtube.com/watch?v=H1Kt1adcr84,https://drive.google.com/file/d/1KEGYRGnI2mNleanuyZqkNR5EFbAwo1fU/view?usp=drive_link,2025-05-27T19:22:10.000Z
27,AI Clone Avatar System,Create Your No Code AI Clone (HeyGen + n8n Full Guide),"This system automates AI clone video creation by integrating HeyGen's API in a no-code workflow. It uses HTTP request nodes for API authentication, dynamically pulls avatar and voice IDs, and implements polling loops with wait steps to check video status. The system processes scripted text inputs to trigger personalized video generation, ensuring error handling and smooth automation. Created by Nate Herk, it comes with a free template available via the community.",Nate Herk | AI Automation,https://www.youtube.com/watch?v=llm60n03x3c,https://drive.google.com/file/d/1Uu0LdyybOcLnDIT4hLG1HA-nVleaZkJf/view?usp=drive_link,2025-05-20T13:59:47.000Z
28,Meeting No-show Eliminator,Slash no-shows with this Ai Agent (free template),"In this video, Rory Ridgers presents a complete automated workflow system that tackles the problem of meeting no-shows. The system is built using n8n and integrates a cow.com trigger, web scraping with HTML-to-markdown conversion, an AI agent for summarizing website and LinkedIn data via Tavly, and CRM updates in Airtable. It also uses Twilio for SMS notifications, Gmail for approval-based emails, and Google Calendar for event management. The free template is available to jumpstart your setup.",Rory Ridgers,https://www.youtube.com/watch?v=1kZzPslvbXg,https://drive.google.com/file/d/1vriUXwdVDod16jFjefSJo3A61olAQpo-/view?usp=drive_link,2025-05-20T11:00:05.000Z
29,Viral Shorts Machine,I Built a 24/7 Viral Shorts Machine with No-Code (free n8n template),"This system is an automated content creation workflow that transforms a simple Google Sheet entry into high-quality viral social media shorts. It integrates multiple AI services including FAL’s Flux for image generation, Cling for video creation, ElevenLabs for audio synthesis, and Creatomate for stitching media together. Blotato is used for auto-posting to Instagram, TikTok, and YouTube. Built by Nate Herk, the workflow runs entirely on no-code principles and comes with a free template download via his Skool community.",Nate Herk | AI Automation,https://www.youtube.com/watch?v=BcfjIBd49C8,https://drive.google.com/file/d/1-znRsMWmFUFbr1lFUjLGr42azzMlxPEz/view?usp=drive_link,2025-05-19T01:24:51.000Z
30,Voice AI Receptionist,This Vapi AI Voice Agent Automates Your Calls (steal this),"In this detailed workflow by Jono Catliff, a voice AI receptionist is built using Vapi and integrated with an n8n automation system. The system leverages Twilio for phone number management and real-time call handling, while also automating invoicing via Go High Level and managing appointment scheduling. The blueprint provides JSON-based parameter formatting and tool coordination, all available for free.",Jono Catliff,https://www.youtube.com/watch?v=XeyrdkFhh_U,https://drive.google.com/file/d/18zq0uteI3AbyhZuq7SuXbrWslGmnPAMu/view?usp=drive_link  https://drive.google.com/file/d/1X01k1Ct6l96z51A8bvJOv_ox4rgCZh3W/view?usp=drive_link ,2025-05-16T17:54:25.000Z
31,AI Copywriter Team,I Built a Team of AI Copywriters in n8n With No Code (Free Template),"This video demonstrates a sophisticated no-code automation system that creates a team of AI copywriters for generating cold emails, VSL scripts, sales letters, and more. The workflow uses n8n to trigger specialized AI agents via OpenAI nodes with detailed context instructions, JSON queries, and assistant setups, while routing outputs to Google Docs. Creator Nolan Harper explains each step and provides a free template via his AI Automation Vault.",Nolan Harper | Ai Automation,https://www.youtube.com/watch?v=GoDmjHs7o-M,https://drive.google.com/file/d/1uEXNL2JtSe8iVkGhZ4tHWFZQUJ3IkfsV/view?usp=drive_link  https://drive.google.com/file/d/1TR72fSRmRKm9b710pKQ2tNC7EwA9K_Ac/view?usp=drive_link ,2025-05-16T16:06:38.000Z
32,Scraping Automation,The Simplest Way to Automate Scraping Anything with No Code (Apify + n8n tutorial),"This system is a no-code data scraping workflow that links Apify's pre-built actors with an n8n automation setup. In the tutorial, Nate Herk demonstrates how to trigger an Apify actor via HTTP endpoints, incorporate a wait step to ensure complete data retrieval, and use polling techniques to systematically capture results such as TikTok video data and Google Maps leads. The walkthrough details API integration and asynchronous processing, and it comes with a free template available via his Skool community.",Nate Herk | AI Automation,https://www.youtube.com/watch?v=gZ_RLC25gCw,https://drive.google.com/file/d/14es-gxH7oZykRPnrgbdEeIK-ECCcY5Xa/view?usp=drive_link,2025-05-16T15:23:10.000Z
33,Viral LinkedIn Posts,I Built an AI SYSTEM For Viral LinkedIn Posts (n8n),"This system automates the creation and publishing of viral social media posts on LinkedIn (with extensions for Instagram and Twitter) using an AI workflow. It integrates web research via Perplexity AI, quality text generation via Anthropic, and image creation with OpenAI Image API while ensuring visual consistency through reference images stored in Google Drive. Google Sheets hold the database of post ideas and statuses, while scheduled triggers auto-publish posts via LinkedIn nodes. Created by Oleg Melnikov, the system is demonstrated in a comprehensive, beginner-friendly tutorial and includes a free template for easy setup.",Oleg Melnikov,https://www.youtube.com/watch?v=YpXzTSZ6csw,https://drive.google.com/file/d/1rWO0ZJ76Sa2hmrXQVQY58n4IaM0e884f/view?usp=drive_link,2025-05-16T13:17:35.000Z
34,Chat File Agent,NEW AI Agent - Chat with YOUR files from Supabase and Google Drive,"This n8n workflow demonstrates an AI agent that interacts with files stored in Google Drive and Supabase. It details the process of uploading files, setting up Supabase tables via SQL, parsing content with YamaParse, and storing vectorized data for subsequent AI querying using OpenAI. The system includes duplicate checks, file updates, and webhooks to trigger the AI agent, all built by Mark and Philipp of 5minAI.",5minAI,https://www.youtube.com/watch?v=NB6LhvObiL4,https://drive.google.com/file/d/1Wd0kKcOyL84zjePOUnkJAKZVt5rlQ4pR/view?usp=drive_link,2025-05-15T16:16:03.000Z
35,Website Data Scraper,Scrape ANY Website Automatically with n8n + Apify (Full System Breakdown),"This system automates the extraction of business data from websites such as Google Maps using a no-code workflow that integrates Apify with an automation platform. It demonstrates the use of HTTP requests, dynamic JSON configurations, filters, loops, and array aggregators to scrape, filter, and aggregate data like phone numbers and emails. The workflow also pipes data into Google Sheets for further use, such as in cold email outreach. Created by Jono Catliff, the free blueprint is available for immediate download.",Jono Catliff,https://www.youtube.com/watch?v=PxQwzoPmP3M,https://drive.google.com/file/d/1KUXLIeeWbxR41E43sGWQFwb_w0aLmulE/view?usp=drive_link,2025-05-15T01:17:07.000Z
36,Multi-Agent Research,This Multi-Agent system can research ANYTHING (free n8n template),"Rory Ridgers presents a sophisticated multi-agent research system built with a workflow platform. This system delegates tasks across specialized AI agents powered by GPT-4 mini and integrated memory nodes. It handles market, company, and social media research by leveraging HTTP requests, Tavly API for advanced searches, and dedicated workflows for scraping and data conversion. The solution also uses Appify for LinkedIn and Instagram profile data extraction. Free templates are provided to get started immediately.",Rory Ridgers,https://www.youtube.com/watch?v=ciogxooQelQ,https://drive.google.com/file/d/19csBF7f40IvE-Q0KQSqCul2JjgHLoZ9H/view?usp=drive_link  https://drive.google.com/file/d/1xD6RrWEkAynJo3Ci9UpLocep7o4hMtGl/view?usp=drive_link  https://drive.google.com/file/d/1CmJykI1mb04Mk33-bS0aPWleIUOZo49G/view?usp=drive_link  https://drive.google.com/file/d/1VFzm_9-xTxNnzlptbosBKSJ4fLbrGoaW/view?usp=drive_link  https://drive.google.com/file/d/14p9y2B0KnOFJqnMWdkFmzZEJFZc2hWdk/view?usp=drive_link  https://drive.google.com/file/d/1PN61vp11bwnwVetjn7W1jiAeJyCvtHUw/view?usp=drive_link  https://drive.google.com/file/d/1FLTlUWdrBHZT397R_627Tmz9zfzPfaK3/view?usp=drive_link  https://drive.google.com/file/d/1cCXjoIt3Q3HNhJBYhblMihm1_JYDaXEL/view?usp=drive_link,2025-05-12T11:01:00.000Z
39,API Agents Workflow,APIs for AI Agents: The Only Beginner’s Guide You’ll Ever Need (n8n),"In this video, Nate Herk demonstrates how to build an AI agent workflow inside a no-code automation platform by integrating external APIs via HTTP requests. The tutorial explains in detail how to set up native integrations and manually configure HTTP requests using curl commands, JSON body parameters, and header authentication. It covers integration with services like Open Weather Map, Perplexity, and Tavi, clarifying error responses and best practices. Free resources for setting up this system are provided via his free community.",Nate Herk | AI Automation,https://www.youtube.com/watch?v=qZkX_gIlwsY,https://drive.google.com/file/d/1hXgATSqAxf_J62Qgm0XdkgQAm_jeE_R6/view?usp=drive_link,2025-05-10T14:12:06.000Z
40,24/7 AI Sales Assistant,I Built a 24/7 AI Sales Assistant (Free Download Inside),"This comprehensive workflow by Nolan Harper uses n8n to deliver a 24/7 AI sales assistant tailored for automating lead capture and personalized follow-up. The system integrates Google Sheets for CRM data management, HTTP nodes to invoke the Tavi API for real-time company research, and advanced AI agents (using GPT-4) to generate custom email subjects, persuasive email bodies, and SMS messages. It also leverages testimonial data and filtering techniques for optimal sales engagement. A free template is available via the AI Automation Vault.",Nolan Harper | Ai Automation,https://www.youtube.com/watch?v=1XPu71Hw_ck,https://drive.google.com/file/d/1S9X2BA_VdqYU8WuCV_ScQTlL-7HVLUXm/view?usp=drive_link,2025-05-09T20:58:42.000Z
41,Human-In-The-Loop Automation,The Secret to Making AI Agents 100% Reliable - Human in the Loop (n8n),"This system automates a human-in-the-loop workflow for approving AI-generated social media content using a no-code environment. It integrates Telegram as the communication channel, utilizes a content creation agent powered by GPT-4.1 along with Tavly search for real-time research, and employs dynamic set nodes for iterative revisions. Built by Nate Herk, the system supports both yes/no approvals and free-text feedback for revisions. A free template to replicate this workflow is available in his Skool community.",Nate Herk | AI Automation,https://www.youtube.com/watch?v=CdnR-fNVPKI,https://drive.google.com/file/d/1f5W6h6lIphgulyZwwcuhKqSQzFCtE0P8/view?usp=drive_link,2025-05-08T23:59:04.000Z
43,LinkedIn Lead Automation,Hijack Viral LinkedIn Posts (No Cold DMs),"This system automates LinkedIn lead generation using a no‑code workflow that scrapes comments from viral posts and enriches contact data in Airtable. It incorporates API scrapers to fetch post details and profile information, applies LLM-based qualification for lead intent, and generates personalized DMs. Built entirely in an n8n framework by MagicOps AI, the system streamlines high intent lead capture, ensuring efficient and tailored outreach.",MagicOps AI,https://www.youtube.com/watch?v=JftnNwvagKA,https://drive.google.com/file/d/1eg3xhPiyj_95ipMDgf4om9T-HWMysO18/view?usp=drive_link,2025-05-06T13:15:03.000Z
